TP_MLOps/data/try_prediction_1.json

{
  "features": [
    {
      "alcohol": 14.23,
      "malic_acid": 1.71,
      "ash": 2.43,
      "alcalinity_of_ash": 15.6,
      "magnesium": 127.0,
      "total_phenols": 2.8,
      "flavanoids": 3.06,
      "nonflavanoid_phenols": 0.28,
      "proanthocyanins": 2.29,
      "color_intensity": 5.64,
      "hue": 1.04,
      "od280/od315_of_diluted_wines": 3.92,
      "proline": 1065.0
    },
    {
      "alcohol": 13.2,
      "malic_acid": 1.78,
      "ash": 2.14,
      "alcalinity_of_ash": 11.2,
      "magnesium": 100.0,
      "total_phenols": 2.65,
      "flavanoids": 2.76,
      "nonflavanoid_phenols": 0.26,
      "proanthocyanins": 1.28,
      "color_intensity": 4.38,
      "hue": 1.05,
      "od280/od315_of_diluted_wines": 3.4,
      "proline": 1050.0
    }
  ]
}

TP_MLOps/README.md

#Author: Mènéli Herve Adjole

Exemple de requête JSON
{
  "features": [
    {
      "alcohol": 14.23,
      "malic_acid": 1.71,
      "ash": 2.43,
      "alcalinity_of_ash": 15.6,
      "magnesium": 127.0,
      "total_phenols": 2.8,
      "flavanoids": 3.06,
      "nonflavanoid_phenols": 0.28,
      "proanthocyanins": 2.29,
      "color_intensity": 5.64,
      "hue": 1.04,
      "od280/od315_of_diluted_wines": 3.92,
      "proline": 1065.0
    }
  ]
}